{
  "$schema": "http://json-schema.org/draft-07/schema#",
  "$id": "https://macsteam.example.com/schemas/save-boundary.schema.json",
  "title": "MacSteam Save Boundary",
  "description": "Schema for save data boundary discovery results describing which paths contain game save data",
  "type": "object",
  "required": [
    "schemaVersion",
    "gameId",
    "confidence",
    "candidates",
    "confirmedPaths",
    "failedDiscovery",
    "discoveredAt"
  ],
  "properties": {
    "schemaVersion": {
 "const": 1,
 "description": "Schema version identifier; must be 1 for this schema revision"
    },
    "gameId": {
 "type": "string",
 "description": "Identifier of the game whose save data boundaries are being described"
    },
    "confidence": {
 "type": "string",
 "description": "Overall confidence level in the save boundary discovery",
 "enum": [
   "unknown",
   "speculative",
   "confirmed",
   "verified"
 ]
    },
    "candidates": {
 "type": "array",
 "description": "Candidate save data paths with individual confidence levels",
 "items": {
   "type": "object",
   "required": ["relativePath", "confidence", "description"],
   "properties": {
     "relativePath": {
       "type": "string",
       "description": "Relative path to a candidate save data location"
     },
     "confidence": {
       "type": "string",
       "description": "Confidence level for this specific candidate",
       "enum": [
         "speculative",
         "confirmed"
       ]
     },
     "description": {
       "type": "string",
       "description": "Human-readable description of what this candidate path represents"
     }
   },
   "additionalProperties": false
 }
    },
    "confirmedPaths": {
 "type": "array",
 "description": "Absolutely confirmed save data paths",
 "items": {
   "type": "string"
 }
    },
    "failedDiscovery": {
 "type": "boolean",
 "description": "Whether the discovery process failed"
    },
    "discoveredAt": {
 "type": "string",
 "description": "ISO 8601 timestamp when this save boundary was determined",
 "format": "date-time"
    }
  },
  "additionalProperties": false
}
